{
  "schema_version": 2,
  "goal_id": "GOAL-DEMO-001",
  "version": 1,
  "event_sequence": 1,
  "objective": "Implement exact recovery.",
  "intent": "PLAN_THEN_BUILD",
  "mode": "PLAN",
  "execution_phase": "PLANNING",
  "planning_depth": "STANDARD",
  "status": "ACTIVE",
  "acceptance_contract_id": "AC-PCH-1.0",
  "current_requirement_id": "REQ-DEMO-001",
  "current_plan_id": "PLAN-DEMO-001",
  "current_stage_id": null,
  "next_action": "Enter the BuildEntryGate.",
  "route_health": { "status": "HEALTHY", "correction_level": "L0", "reason_codes": ["PLAN_VALID"], "evaluated_at_sequence": 1 },
  "assumptions": [{ "id": "ASM-DEMO-001", "status": "SUPPORTED", "sha256": "0000000000000000000000000000000000000000000000000000000000000000" }],
  "pending_effects": [],
  "active_performance_trial": null,
  "prompt_generation": { "id": "PROMPT-GEN-DEMO-002", "sha256": "1111111111111111111111111111111111111111111111111111111111111111" },
  "prompt_request": { "id": "PROMPT-REQ-DEMO-002", "sha256": "2222222222222222222222222222222222222222222222222222222222222222" },
  "cache_lineage": null,
  "response_contract": null,
  "latest_checkpoint_id": "CHECKPOINT-DEMO-001",
  "lease": { "owner_session_id": "SESSION-DEMO-001", "generation": 1, "fencing_token": 1, "expires_at": "2026-07-21T12:01:00Z" }
}
